{
  "$schema": "./interop-map.schema.json",
  "$comment": "RFC 0208 (RFC 0198 adds mcp.tasks). Normative: spec/v2/core/interop.md §\"The operation mappings\" incorporates every row. Hand-maintained; checked by scripts/check-interop-map.mjs against api/v2/openapi.yaml operationIds, spec/v2/errors.json codes, the RunSnapshot.status enum and the spec/v2/facets/ schemas. Upstream names are verbatim; `v2Operation` is an operationId in api/v2/openapi.yaml or null when no v2 operation serves the row. Ships in @openwop/spec-artifacts.",
  "version": 1,
  "updated": "2026-09-22",
  "pins": {
    "a2a": {
      "release": "1.0.1",
      "negotiated": "1.0",
      "spec": "https://github.com/a2aproject/A2A/blob/v1.0.1/docs/specification.md",
      "proto": "https://github.com/a2aproject/A2A/blob/v1.0.1/specification/a2a.proto"
    },
    "mcp": {
      "revision": "2026-07-28",
      "spec": "https://modelcontextprotocol.io/specification/2026-07-28",
      "schema": "https://github.com/modelcontextprotocol/modelcontextprotocol/blob/main/schema/2026-07-28/schema.ts"
    }
  },
  "a2a": {
    "operations": [
      {
        "upstream": "SendMessage",
        "http": "POST /message:send",
        "when": "no taskId",
        "v2Operation": "createRun",
        "requires": [],
        "rule": "Starts a run of the workflow whose id is the resolved skill id. Blocks until terminal, INPUT_REQUIRED or the host's request timeout, then answers the current Task; with configuration.returnImmediately it answers once the run is accepted, which requires a2a.durableTasks (else UnsupportedOperationError). message.messageId is the idempotency seed: a repeat from the same peer principal MUST NOT create a second run."
      },
      {
        "upstream": "SendMessage",
        "http": "POST /message:send",
        "when": "taskId, run waiting-approval | waiting-input | waiting-external",
        "v2Operation": "resolveInterruptByRun",
        "requires": [],
        "rule": "The message resolves the open interrupt as its resumeValue (approval actions via metadata.openwop.interrupt), with the eligibility interrupt.md requires."
      },
      {
        "upstream": "SendMessage",
        "http": "POST /message:send",
        "when": "taskId, run not suspended and not terminal",
        "v2Operation": null,
        "requires": [],
        "rule": "Delivered through a declared input path, else UnsupportedOperationError. MUST NOT be silently dropped."
      },
      {
        "upstream": "SendMessage",
        "http": "POST /message:send",
        "when": "taskId, run terminal and retained",
        "v2Operation": null,
        "requires": [],
        "rule": "UnsupportedOperationError (A2A §3.1.1). No event is appended."
      },
      {
        "upstream": "SendStreamingMessage",
        "http": "POST /message:stream",
        "when": "as SendMessage",
        "v2Operation": "streamRunEvents",
        "requires": [
          "a2a.streaming"
        ],
        "rule": "As SendMessage, with the run's events projected as StreamResponse (the StreamResponse field row). Ends after the terminal statusUpdate."
      },
      {
        "upstream": "GetTask",
        "http": "GET /tasks/{id}",
        "when": "",
        "v2Operation": "getRun",
        "requires": [],
        "rule": "Task projected by taskState; historyLength truncates the response only."
      },
      {
        "upstream": "ListTasks",
        "http": "GET /tasks",
        "when": "",
        "v2Operation": "listRuns",
        "requires": [],
        "rule": "The result set is the set listRuns returns to the same Subject, whether or not runList is advertised, filtered by contextId (A2ATaskState.contextId), status (taskState inverse) and statusTimestampAfter; ordered by status timestamp, newest first; pageSize 1-100, default 50; nextPageToken always present, empty on the last page; artifacts omitted unless includeArtifacts."
      },
      {
        "upstream": "CancelTask",
        "http": "POST /tasks/{id}:cancel",
        "when": "",
        "v2Operation": "cancelRun",
        "requires": [],
        "rule": "Answers the Task at TASK_STATE_WORKING while cancelling, TASK_STATE_CANCELED once cancelled; a terminal run is TaskNotCancelableError."
      },
      {
        "upstream": "SubscribeToTask",
        "http": "POST /tasks/{id}:subscribe",
        "when": "",
        "v2Operation": "streamRunEvents",
        "requires": [
          "a2a.streaming",
          "a2a.durableTasks"
        ],
        "rule": "First event is the current Task; read-only re-attachment that MUST NOT re-execute or re-accept a message; a terminal task is UnsupportedOperationError."
      },
      {
        "upstream": "CreateTaskPushNotificationConfig",
        "http": "POST /tasks/{id}/pushNotificationConfigs",
        "when": "",
        "v2Operation": null,
        "requires": [
          "a2a.pushNotifications"
        ],
        "rule": "Persists A2ATaskState.pushConfig. url MUST pass the webhooks.md egress guard, scheme and address arms both; token and authentication.credentials are secrets held by reference and MUST NOT enter the event log, the persisted A2ATaskState or a debug bundle. Unadvertised: PushNotificationNotSupportedError."
      },
      {
        "upstream": "GetTaskPushNotificationConfig | ListTaskPushNotificationConfigs | DeleteTaskPushNotificationConfig",
        "http": "GET | GET | DELETE /tasks/{id}/pushNotificationConfigs[/{configId}]",
        "when": "",
        "v2Operation": null,
        "requires": [
          "a2a.pushNotifications"
        ],
        "rule": "Reads or deletes the persisted configs of a task the caller can read; secrets are never returned."
      },
      {
        "upstream": "GetExtendedAgentCard",
        "http": "GET /extendedAgentCard",
        "when": "",
        "v2Operation": null,
        "requires": [],
        "rule": "Authorized at the OpenWOP boundary; MUST NOT disclose skills, interfaces or security requirements the caller cannot use. Not configured: ExtendedAgentCardNotConfiguredError."
      }
    ],
    "card": [
      {
        "element": "supportedInterfaces[]",
        "rule": "Only interfaces the host routes. The set of protocolVersion values equals a2a.versions; the preferredVersion interface is listed first. Claiming profile a2a-1.0 requires a JSONRPC interface at 1.0; HTTP+JSON and GRPC are optional."
      },
      {
        "element": "capabilities",
        "rule": "streaming and pushNotifications equal the a2a facets; extendedAgentCard is true iff GetExtendedAgentCard is served; extensions[] lists only extensions the host implements."
      },
      {
        "element": "skills[]",
        "rule": "One skill per invocable workflow from the registry runtime routing uses; skills[].id is the routed workflowId; no skill the host does not route."
      },
      {
        "element": "securitySchemes | securityRequirements",
        "rule": "Exactly the authentication the endpoint enforces; they describe how a peer authenticates, never what it may do."
      },
      {
        "element": "provider",
        "rule": "Names the organization operating the endpoint; its url SHOULD equal implementation.url when both are present."
      },
      {
        "element": "supportedInterfaces[].tenant",
        "rule": "A routing hint that never selects the tenant of record. Per-agent routing values (a2aTenant) are specified by interop.md §Per-agent cards (RFC 0202)."
      },
      {
        "element": "signatures[]",
        "rule": "A host SHOULD sign its card; a consuming host SHOULD verify before invoking and MAY refuse an unsigned card."
      }
    ],
    "taskState": [
      {
        "runStatus": "pending",
        "stored": "submitted",
        "wire": "TASK_STATE_SUBMITTED"
      },
      {
        "runStatus": "running",
        "stored": "working",
        "wire": "TASK_STATE_WORKING"
      },
      {
        "runStatus": "paused",
        "stored": "working",
        "wire": "TASK_STATE_WORKING"
      },
      {
        "runStatus": "cancelling",
        "stored": "working",
        "wire": "TASK_STATE_WORKING"
      },
      {
        "runStatus": "waiting-approval",
        "stored": "input-required",
        "wire": "TASK_STATE_INPUT_REQUIRED",
        "carrier": "metadata.openwop.interrupt.kind"
      },
      {
        "runStatus": "waiting-input",
        "stored": "input-required",
        "wire": "TASK_STATE_INPUT_REQUIRED",
        "carrier": "metadata.openwop.interrupt.kind"
      },
      {
        "runStatus": "waiting-external",
        "stored": "input-required",
        "wire": "TASK_STATE_INPUT_REQUIRED",
        "carrier": "metadata.openwop.interrupt.kind"
      },
      {
        "runStatus": "completed",
        "stored": "completed",
        "wire": "TASK_STATE_COMPLETED"
      },
      {
        "runStatus": "failed",
        "stored": "failed",
        "wire": "TASK_STATE_FAILED"
      },
      {
        "runStatus": "cancelled",
        "stored": "canceled",
        "wire": "TASK_STATE_CANCELED"
      }
    ],
    "taskStateReverse": [
      {
        "wire": "TASK_STATE_SUBMITTED",
        "runStatus": "pending"
      },
      {
        "wire": "TASK_STATE_WORKING",
        "runStatus": "running"
      },
      {
        "wire": "TASK_STATE_INPUT_REQUIRED",
        "runStatus": "waiting-input"
      },
      {
        "wire": "TASK_STATE_AUTH_REQUIRED",
        "runStatus": "waiting-input",
        "note": "reverse only until RFC 0199 lands: waiting-input with metadata.subkind auth; the forward source is RFC 0199's credential interrupt, whose override row RFC 0199 adds to a2a.taskState"
      },
      {
        "wire": "TASK_STATE_COMPLETED",
        "runStatus": "completed"
      },
      {
        "wire": "TASK_STATE_FAILED",
        "runStatus": "failed"
      },
      {
        "wire": "TASK_STATE_CANCELED",
        "runStatus": "cancelled"
      },
      {
        "wire": "TASK_STATE_REJECTED",